specialty,symptoms
ENT,sinus pressure in the morning
ENT,tonsil inflammation for 3 days
Neurology,intermittent episodes of tingling
Dermatology,skin discoloration during exercise
Gastroenterology,vomiting with discharge
Pulmonology,recurrent lung infection for a month
Gastroenterology,constipation with discharge
Endocrinology,heat intolerance for 3 days
Hematology,nosebleeds for 2 weeks
Dermatology,blisters with nausea
Hematology,pale skin during hot weather
Hematology,recurrent swollen lymph nodes
Pulmonology,persistent cough after eating
Pulmonology,chest tightness at rest
Orthopedics,moderate bone pain
Orthopedics,intermittent fracture pain
Ophthalmology,eye discharge for 3 days
ENT,tonsil inflammation during exercise
Gastroenterology,chronic heartburn
Cardiology,constant fainting
Cardiology,swelling in legs for a week
Gastroenterology,bloating during exercise
Gastroenterology,constipation for 2 days
ENT,runny nose for a month
Cardiology,chest pain with sensory loss
Cardiology,fainting for a month
Cardiology,constant palpitations
Oncology,difficulty swallowing with fever
Oncology,chronic pain
Dermatology,dry skin with blood
Pulmonology,burning coughing blood
Ophthalmology,recurrent double vision
Endocrinology,excessive thirst with associated weight gain
Pulmonology,shortness of breath on exertion since last night
Neurology,weakness with fever
Dermatology,blisters for a week
Gastroenterology,progressive blood in stool
Pulmonology,chronic cough worsening over time
Psychiatry,gradual onset of loss of interest
Oncology,chronic pain for a week
Cardiology,palpitations for 2 days
Oncology,blood in cough that prevents sleep
Ophthalmology,red eye at rest
Endocrinology,intermittent heat intolerance
Orthopedics,alternating fracture pain and back pain
Hematology,alternating swollen lymph nodes and excessive bleeding
Oncology,burning persistent lumps
Endocrinology,fatigue for several weeks
Cardiology,progressive chest tightness
Pulmonology,chronic cough for a month
Pulmonology,recurrent lung infection accompanied by swelling
Cardiology,recurrent palpitations
Ophthalmology,red eye for a month
Pediatrics,diarrhea child for a month
Pediatrics,recurrent fever in child
Ophthalmology,worse in the morning: double vision
Orthopedics,hip pain for a month
Endocrinology,chronic hair loss
Gastroenterology,acid reflux accompanied by redness
Dermatology,itching for a month
Gastroenterology,constant nausea
Neurology,recurrent weakness
Endocrinology,worse in the morning: fatigue
Hematology,moderate blood in urine
Dermatology,acne for 2 days
Hematology,recurrent frequent infections
Pediatrics,diarrhea child for 2 days
Gastroenterology,acid reflux for a month
Orthopedics,gradual onset of limb weakness
Hematology,excessive bleeding with sensory loss
Pediatrics,delayed milestones for a month
Ophthalmology,mild double vision
Pulmonology,exercise-induced wheeze with fever
Endocrinology,alternating excessive thirst and fatigue
Gastroenterology,worse when lying down: vomiting
Gastroenterology,constipation after eating
Hematology,nosebleeds during exercise
Cardiology,improved with rest: swelling in legs
Hematology,swollen lymph nodes at night
Gynecology,intermittent infertility
Orthopedics,burning bone pain
Hematology,intermittent episodes of swollen lymph nodes
Ophthalmology,sudden eye discharge
ENT,swallowing difficulty at night
ENT,worse in the morning: runny nose
Oncology,improved with rest: loss of appetite
Psychiatry,gradual onset of panic attacks
Gastroenterology,intermittent episodes of heartburn
Hematology,excessive bleeding with blood
Ophthalmology,sudden vision loss accompanied by redness
Cardiology,swelling in legs with associated shortness of breath
Dermatology,recurrent sun sensitivity
Hematology,intermittent blood in urine
Dermatology,itching for a week
Psychiatry,hallucinations after cold exposure
Endocrinology,weight gain with vomiting
Pediatrics,intermittent cough in child
Pediatrics,alternating poor feeding and rash in child
Cardiology,recurrent shortness of breath
Hematology,alternating easy bruising and night sweats
Dermatology,sudden acne
Neurology,seizures accompanied by swelling
Pulmonology,worse in the morning: chronic cough
Gynecology,severe pain during intercourse
Pulmonology,worse when lying down: chronic cough
ENT,runny nose at rest
Endocrinology,weight loss
Gynecology,vaginal discharge with blood
ENT,sinus pressure for 3 days
Endocrinology,alternating frequent urination and heat intolerance
ENT,sore throat with discharge
Pediatrics,poor feeding
Gynecology,heavy menstrual bleeding for a month
Neurology,headache and headache
Psychiatry,hallucinations for 2 days
Oncology,persistent fever and fainting
Ophthalmology,blurred vision worsening over time
Neurology,numbness since last night
Neurology,speech difficulty for a month
Orthopedics,intermittent hip pain
Hematology,intermittent excessive bleeding
Gynecology,recurrent vaginal discharge
Ophthalmology,sensitivity to light with discharge
Dermatology,sudden onset of acne
Gastroenterology,stomach pain with nausea
Gastroenterology,diarrhea for 2 days
Cardiology,constant dizziness
Orthopedics,hip pain with associated fracture pain
Gastroenterology,severe abdominal pain
Pediatrics,cough in child for 2 weeks
Pulmonology,exercise-induced wheeze at rest
Pulmonology,intermittent breathing difficulty at night
Cardiology,sharp shortness of breath
Endocrinology,hot flashes since last night
Pediatrics,moderate delayed milestones
Orthopedics,bone pain since last night
Pediatrics,recurrent poor feeding
ENT,sore throat during exercise
Ophthalmology,sudden vision loss accompanied by swelling
Dermatology,dry skin with weakness
Psychiatry,improved with rest: hallucinations
Gastroenterology,bloating after cold exposure
Hematology,intermittent episodes of excessive bleeding
Pulmonology,breathing difficulty at night for 2 weeks
Oncology,loss of appetite with discharge
Oncology,severe unexplained fatigue
Gastroenterology,acid reflux with weakness
Gynecology,chronic irregular periods
Ophthalmology,double vision accompanied by redness
Endocrinology,constant cold intolerance
Pediatrics,recurrent vomiting child
Gynecology,pain during intercourse with weakness
Oncology,night sweats that prevents sleep
Ophthalmology,blurred vision after cold exposure
Ophthalmology,constant sensitivity to light
Pediatrics,constant not gaining weight
Oncology,progressive chronic pain and night sweats
Psychiatry,progressive compulsive behaviors
ENT,alternating sinus pressure and swallowing difficulty
Psychiatry,insomnia and fainting
Ophthalmology,severe blurred vision
Endocrinology,menstrual irregularity and dizziness
Hematology,frequent infections worsening over time
Orthopedics,joint swelling during exercise
Oncology,persistent fever since last night
Orthopedics,intermittent limb weakness
Cardiology,chronic leg edema
Ophthalmology,recurrent tearing
ENT,voice change after eating
ENT,worse when lying down: nasal congestion
Cardiology,mild leg edema
Neurology,numbness and numbness
Psychiatry,sudden onset of panic attacks
Pulmonology,mild wheezing
Dermatology,recurrent blisters
ENT,intermittent episodes of nasal congestion
Orthopedics,recurrent joint stiffness
Oncology,constant difficulty swallowing
Pediatrics,severe lethargy in infant
Dermatology,improved with rest: blisters
Hematology,fatigue with anemia with blood
Endocrinology,progressive hair loss and excessive thirst
Pulmonology,persistent cough for a month
Endocrinology,cold intolerance with discharge
Orthopedics,sudden onset of bone pain
Hematology,nosebleeds for a month
Hematology,throbbing fatigue with anemia
Ophthalmology,dry eyes for a month
Psychiatry,recurrent suicidal thoughts
Cardiology,palpitations with nausea
Psychiatry,moderate suicidal thoughts
Oncology,persistent lumps accompanied by swelling
Oncology,unexplained fatigue with sensory loss
Neurology,alternating migraine and headache
Dermatology,worse in the morning: skin discoloration
Neurology,dizziness for a month
Pediatrics,lethargy in infant with associated high-pitched cry
Gynecology,alternating heavy menstrual bleeding and menstrual cramps
Endocrinology,progressive excessive thirst and hair loss
Psychiatry,compulsive behaviors during hot weather
Psychiatry,mild memory problems from depression
Hematology,nosebleeds at rest
ENT,intermittent episodes of tonsil inflammation
Neurology,numbness during hot weather
Gastroenterology,sudden heartburn
Dermatology,skin discoloration with weakness
Endocrinology,frequent urination with weakness
ENT,mild tonsil inflammation
Gynecology,pelvic pressure with sensory loss
Pediatrics,burning cough in child
Hematology,easy bruising that prevents sleep
Pediatrics,poor feeding for 2 days
Ophthalmology,chronic blurred vision
Pediatrics,moderate fever in child
Psychiatry,memory problems from depression during exercise
Hematology,progressive blood in stool and blood in urine
Endocrinology,recurrent weight loss
Pulmonology,throbbing shortness of breath on exertion
Gastroenterology,diarrhea with associated blood in stool
Psychiatry,anxiety attacks with blood
Gynecology,pelvic pressure for a month
Pulmonology,persistent cough with sensory loss
Dermatology,scaly skin and fainting
ENT,ear pain for a month
ENT,tinnitus with blood
Gynecology,sudden heavy menstrual bleeding
Gastroenterology,constipation for a month
Orthopedics,shoulder pain for a month
Oncology,skin changes after eating
Cardiology,fainting with vomiting
Pulmonology,coughing blood and coughing blood
Endocrinology,intermittent hot flashes
ENT,severe sinus pressure
Gynecology,moderate breast lump
Dermatology,throbbing itching
Oncology,recurrent chronic pain
Endocrinology,cold intolerance for several weeks
Pulmonology,constant chest tightness
Cardiology,dizziness accompanied by swelling
Pediatrics,severe cough in child
Neurology,recurrent tingling
Psychiatry,intermittent compulsive behaviors
Orthopedics,bone pain for 2 weeks
Dermatology,worse in the morning: blisters
Orthopedics,joint stiffness and fracture pain
Orthopedics,knee pain with sensory loss
Oncology,constant chronic pain
Psychiatry,severe mood swings
Pulmonology,persistent cough during hot weather
Gynecology,infertility and vaginal discharge
Orthopedics,joint swelling and fainting
Ophthalmology,sudden vision loss for a week
Neurology,sharp speech difficulty
Oncology,night sweats with sensory loss
Ophthalmology,dry eyes with sensory loss
ENT,worse when lying down: tonsil inflammation
ENT,sudden tonsil inflammation
Gastroenterology,severe acid reflux
Neurology,progressive speech difficulty
Ophthalmology,improved with rest: double vision
Psychiatry,recurrent hallucinations
Neurology,memory loss with fever
Dermatology,constant blisters
Ophthalmology,tearing for several weeks
Gynecology,postmenopausal bleeding after eating
Endocrinology,sharp hair loss
Hematology,fatigue with anemia with weakness
Pediatrics,fever in child during hot weather
Cardiology,recurrent dizziness
Gastroenterology,diarrhea and dizziness
Psychiatry,memory problems from depression for 2 weeks
Pediatrics,poor feeding with blood
Pulmonology,burning recurrent lung infection
Endocrinology,fatigue during hot weather
Endocrinology,weight gain with nausea
Neurology,tingling with sensory loss
Oncology,persistent fever with discharge
Orthopedics,chronic knee pain
Orthopedics,limb weakness during hot weather
Dermatology,acne for 3 days
Pediatrics,high-pitched cry after eating
Cardiology,severe leg edema
Neurology,headache at rest
Orthopedics,knee pain with blood
Gynecology,breast lump with nausea
Dermatology,scaly skin with weakness
Oncology,severe night sweats
Pulmonology,recurrent lung infection that prevents sleep
Gynecology,infertility with blood
Endocrinology,menstrual irregularity accompanied by redness
Oncology,loss of appetite during exercise
Psychiatry,throbbing anxiety attacks
Pediatrics,moderate poor feeding
Hematology,nosebleeds and dizziness
Endocrinology,progressive excessive thirst
Pulmonology,sharp productive cough
Pediatrics,poor feeding at rest
Psychiatry,chronic compulsive behaviors
Oncology,blood in cough for 3 days
Pulmonology,wheezing for a month
Ophthalmology,double vision
Pediatrics,gradual onset of lethargy in infant
Pulmonology,coughing blood with associated shortness of breath on exertion
Gastroenterology,bloating for several days
Dermatology,sun sensitivity during exercise
Dermatology,progressive skin discoloration
Hematology,night sweats with blood
Pediatrics,intermittent episodes of high-pitched cry
Psychiatry,suicidal thoughts with associated suicidal thoughts
Dermatology,intermittent episodes of acne
Gynecology,gradual onset of pain during intercourse
Hematology,blood in urine for 3 days
Cardiology,rapid heartbeat after cold exposure
Oncology,constant skin changes
Orthopedics,limb weakness for a week
Endocrinology,constant hair loss
Neurology,tingling that prevents sleep
Endocrinology,intermittent fatigue
Orthopedics,difficulty walking with vomiting
Ophthalmology,red eye after cold exposure
Psychiatry,suicidal thoughts in the morning
Psychiatry,compulsive behaviors for several days
Gastroenterology,intermittent episodes of diarrhea
Dermatology,mild blisters
Hematology,pale skin worsening over time
ENT,nasal congestion with fever
Gastroenterology,improved with rest: vomiting
Psychiatry,intermittent episodes of mood swings
Gynecology,burning vaginal discharge
Neurology,seizures for several weeks
Hematology,pale skin for a week
Dermatology,scaly skin and skin discoloration
Oncology,persistent lumps that prevents sleep
Orthopedics,limb weakness accompanied by redness
Neurology,speech difficulty
Hematology,pale skin after cold exposure
Orthopedics,severe bone pain
Orthopedics,progressive shoulder pain and bone pain
Gastroenterology,moderate diarrhea
Pediatrics,not gaining weight and dizziness
Neurology,throbbing migraine
Gynecology,sharp breast lump
Oncology,recurrent skin changes
Orthopedics,fracture pain and dizziness
Dermatology,moderate sun sensitivity
Neurology,seizures
Gynecology,worse when lying down: pelvic pressure
ENT,sharp tinnitus
Hematology,progressive blood in stool and pale skin
Endocrinology,severe weight gain
Cardiology,fainting with fever
Neurology,blurred vision during exercise
Dermatology,constant red patches
Gastroenterology,throbbing heartburn
Gastroenterology,bloating that prevents sleep
Ophthalmology,intermittent tearing
Gastroenterology,progressive acid reflux
Ophthalmology,recurrent eye pain
Hematology,worse in the morning: blood in stool
Gynecology,recurrent postmenopausal bleeding
Dermatology,dry skin during hot weather
Ophthalmology,mild red eye
Orthopedics,difficulty walking for several weeks
Pediatrics,not gaining weight that prevents sleep
Hematology,easy bruising with blood
Gynecology,irregular periods during hot weather
Pediatrics,fever in child for a week
Neurology,severe seizures
Hematology,easy bruising with sensory loss
Endocrinology,moderate hot flashes
Pediatrics,rash in child in the morning
Ophthalmology,mild tearing
Oncology,progressive skin changes
ENT,intermittent episodes of hearing loss
Ophthalmology,throbbing sensitivity to light
Neurology,blurred vision with fever
Gynecology,worse in the morning: postmenopausal bleeding
Psychiatry,gradual onset of persistent sadness
Hematology,intermittent night sweats
ENT,intermittent ear pain
Psychiatry,gradual onset of anxiety attacks
Dermatology,hives worsening over time
Dermatology,acne with fever
Oncology,improved with rest: persistent lumps
ENT,intermittent tinnitus
Hematology,night sweats for several days
Oncology,sudden onset of persistent lumps
Endocrinology,severe heat intolerance
Cardiology,irregular heartbeat accompanied by swelling
Psychiatry,hallucinations and fainting
Gynecology,improved with rest: menstrual cramps
Pulmonology,sudden onset of persistent cough
Ophthalmology,sudden vision loss for 2 days
Neurology,dizziness and fainting
Ophthalmology,gradual onset of eye pain
Ophthalmology,eye pain for a month
Dermatology,recurrent itching
Pulmonology,mild breathing difficulty at night
Orthopedics,hip pain with blood
Pulmonology,sudden onset of coughing blood
Pulmonology,productive cough at rest
Gynecology,severe pelvic pressure
Ophthalmology,sudden vision loss in the morning
Hematology,recurrent blood in urine
Gynecology,constant vaginal discharge
Orthopedics,joint swelling for 2 days
Hematology,frequent infections since last night
Ophthalmology,floaters and floaters
Pediatrics,vomiting child for a month
Hematology,intermittent swollen lymph nodes
Pulmonology,worse when lying down: exercise-induced wheeze
Oncology,night sweats at rest
Orthopedics,mild bone pain
Neurology,constant numbness
Neurology,improved with rest: blurred vision
Gastroenterology,blood in stool for a week
Psychiatry,loss of interest and hallucinations
Pediatrics,delayed milestones for 2 weeks
Gastroenterology,intermittent bloating
Psychiatry,intermittent persistent sadness
Gynecology,heavy menstrual bleeding during hot weather
Hematology,pale skin with vomiting
Dermatology,itching accompanied by swelling
Pediatrics,constant cough in child
Gastroenterology,blood in stool during exercise
Cardiology,severe chest tightness
Endocrinology,weight loss during exercise
Hematology,easy bruising and pale skin
Pediatrics,severe high-pitched cry
Ophthalmology,sudden vision loss for 2 weeks
Psychiatry,moderate mood swings
Psychiatry,progressive loss of interest
Hematology,night sweats for 2 weeks
Gynecology,sharp pelvic pressure
Pulmonology,coughing blood for 2 weeks
Gastroenterology,chronic nausea
Gastroenterology,constant constipation
Pulmonology,constant shortness of breath on exertion
Psychiatry,sharp anxiety attacks
Ophthalmology,red eye accompanied by redness
Pulmonology,chest tightness and fainting
Gastroenterology,acid reflux for several days
Orthopedics,fracture pain with fever
Orthopedics,shoulder pain that prevents sleep
Dermatology,blisters during exercise
Cardiology,recurrent swelling in legs
Dermatology,acne with sensory loss
Hematology,recurrent fatigue with anemia
Psychiatry,improved with rest: panic attacks
Endocrinology,hair loss with sensory loss
Hematology,frequent infections with associated pale skin
Endocrinology,excessive thirst
Hematology,throbbing easy bruising
Endocrinology,weight gain for 3 days
Hematology,swollen lymph nodes accompanied by redness
Oncology,constant persistent lumps
Orthopedics,joint stiffness during exercise
Dermatology,scaly skin with blood
ENT,voice change during exercise
Psychiatry,compulsive behaviors after cold exposure
Psychiatry,moderate insomnia
ENT,hearing loss with discharge
Pulmonology,sudden coughing blood
Pediatrics,recurrent lethargy in infant
Oncology,unexplained weight loss and dizziness
Gynecology,mild breast lump
Endocrinology,gradual onset of hair loss
Gynecology,pelvic pain for a week
Orthopedics,hip pain during hot weather
Dermatology,blisters for a month
Endocrinology,sudden cold intolerance
Ophthalmology,chronic tearing
Orthopedics,joint stiffness for a month
Neurology,sudden onset of seizures
Orthopedics,throbbing joint stiffness
Psychiatry,persistent sadness with sensory loss
Cardiology,swelling in legs during exercise
Neurology,migraine during hot weather
Hematology,blood in urine for a month
Cardiology,swelling in legs for several days
Ophthalmology,eye discharge after eating
Neurology,headache for several days
Gynecology,heavy menstrual bleeding for several weeks
Gynecology,vaginal discharge with associated irregular periods
Gastroenterology,nausea for several weeks
Pulmonology,shortness of breath on exertion for 2 days
Oncology,worse in the morning: skin changes
Pulmonology,wheezing at night
Psychiatry,worse in the morning: insomnia
Hematology,frequent infections with discharge
Orthopedics,recurrent shoulder pain
Orthopedics,moderate back pain
Neurology,memory loss during exercise
Orthopedics,shoulder pain with nausea
Gastroenterology,recurrent bloating
Pediatrics,constant diarrhea child
Ophthalmology,recurrent sensitivity to light
Neurology,intermittent headache
Pulmonology,recurrent shortness of breath on exertion
Pediatrics,sharp delayed milestones
ENT,progressive sore throat
Neurology,numbness for 3 days
Gynecology,pelvic pressure accompanied by swelling
Oncology,mild loss of appetite
Gastroenterology,recurrent blood in stool
Ophthalmology,mild eye discharge
Gastroenterology,constipation for a week
Orthopedics,back pain with fever
Psychiatry,compulsive behaviors with discharge
Dermatology,dry skin with vomiting
Orthopedics,knee pain for 3 days
Gynecology,vaginal discharge that prevents sleep
Gastroenterology,bloating for 2 weeks
Pulmonology,shortness of breath on exertion at rest
Oncology,blood in cough during hot weather
Psychiatry,improved with rest: persistent sadness
Psychiatry,hallucinations during exercise
Pediatrics,intermittent not gaining weight
Psychiatry,mood swings for several days
Ophthalmology,worse in the morning: dry eyes
ENT,sudden onset of swallowing difficulty
Cardiology,burning fainting
ENT,ear pain with associated nasal congestion
Dermatology,dry skin for 2 weeks
Orthopedics,burning fracture pain
Cardiology,alternating palpitations and leg edema
Oncology,sudden unexplained fatigue
Hematology,easy bruising with associated swollen lymph nodes
Cardiology,palpitations accompanied by redness
Gastroenterology,stomach pain for several days
Neurology,sharp weakness
ENT,moderate ear pain
Pediatrics,worse in the morning: diarrhea child
Ophthalmology,eye discharge after cold exposure
Pediatrics,sudden cough in child
Psychiatry,burning insomnia
Hematology,pale skin accompanied by redness
Gynecology,alternating breast lump and menstrual cramps
Psychiatry,recurrent memory problems from depression
Orthopedics,intermittent difficulty walking
Orthopedics,joint swelling with weakness
Dermatology,itching in the morning
Orthopedics,mild fracture pain
Pulmonology,coughing blood with nausea
Pulmonology,chest tightness for 3 days
Dermatology,red patches with sensory loss
Pulmonology,progressive productive cough and chest tightness
Oncology,chronic pain for several days
Pediatrics,sudden diarrhea child
Ophthalmology,sharp eye pain
Gastroenterology,abdominal pain for a week
ENT,severe voice change
Pulmonology,intermittent episodes of chronic cough
Endocrinology,mild weight gain
ENT,chronic sinus pressure
Cardiology,sudden chest pain
Pediatrics,vomiting child with weakness
Endocrinology,gradual onset of heat intolerance
Gastroenterology,alternating bloating and nausea
Hematology,sudden onset of blood in urine
ENT,alternating nasal congestion and sore throat
Ophthalmology,mild floaters
ENT,tinnitus for a week
Ophthalmology,double vision and sensitivity to light
Cardiology,gradual onset of dizziness
Gynecology,mild irregular periods
Hematology,swollen lymph nodes for a month
Endocrinology,fatigue with associated excessive thirst
Ophthalmology,tearing at rest
Gynecology,pain during intercourse after eating
Hematology,excessive bleeding for 2 weeks
Psychiatry,insomnia for 3 days
Endocrinology,moderate hair loss
Gastroenterology,severe nausea
Oncology,night sweats with discharge
Orthopedics,alternating bone pain and joint stiffness
Cardiology,improved with rest: rapid heartbeat
Cardiology,irregular heartbeat with vomiting
Orthopedics,mild back pain
Pediatrics,diarrhea child since last night
Endocrinology,intermittent episodes of hair loss
Psychiatry,memory problems from depression for a week
Gastroenterology,heartburn with weakness
ENT,swallowing difficulty and dizziness
Cardiology,alternating dizziness and shortness of breath
Pediatrics,vomiting child for 2 days
Pulmonology,exercise-induced wheeze for 2 weeks
Ophthalmology,dry eyes at rest
ENT,worse in the morning: ear pain
Endocrinology,severe cold intolerance
Gynecology,throbbing postmenopausal bleeding
Gastroenterology,moderate acid reflux
Cardiology,mild swelling in legs
Orthopedics,knee pain and fracture pain
Ophthalmology,red eye accompanied by swelling
Cardiology,swelling in legs with blood
Neurology,dizziness and memory loss
Orthopedics,improved with rest: joint stiffness
Cardiology,recurrent rapid heartbeat
Endocrinology,recurrent cold intolerance
Gastroenterology,stomach pain accompanied by swelling
Neurology,memory loss with vomiting
Pulmonology,progressive productive cough and coughing blood
ENT,runny nose
Cardiology,dizziness with vomiting
Hematology,fatigue with anemia after cold exposure
Oncology,gradual onset of unexplained weight loss
Cardiology,alternating fainting and dizziness
Psychiatry,mood swings that prevents sleep
Ophthalmology,severe eye discharge
Gynecology,irregular periods for a month
Hematology,blood in urine
Pulmonology,coughing blood for a week
Ophthalmology,progressive eye discharge
ENT,voice change worsening over time
Dermatology,intermittent acne
Psychiatry,mild persistent sadness
Pediatrics,cough in child with nausea
Psychiatry,severe insomnia
Cardiology,recurrent irregular heartbeat
Cardiology,dizziness with fever
ENT,alternating swallowing difficulty and tinnitus
Neurology,moderate tingling
Gastroenterology,constipation at night
Orthopedics,fracture pain for a month
Ophthalmology,double vision and tearing
Endocrinology,cold intolerance for a month
ENT,runny nose after cold exposure
Neurology,weakness and weakness
Neurology,weakness with vomiting
Hematology,frequent infections for several days
Endocrinology,cold intolerance and fainting
Gastroenterology,diarrhea after cold exposure
Endocrinology,sharp frequent urination
Cardiology,moderate dizziness
Ophthalmology,sudden vision loss with weakness
Oncology,persistent lumps at night
Oncology,recurrent difficulty swallowing
Pulmonology,intermittent persistent cough
ENT,hearing loss and voice change
Neurology,intermittent episodes of blurred vision
Neurology,dizziness with nausea
Endocrinology,intermittent frequent urination
Cardiology,fainting during hot weather
Pediatrics,chronic high-pitched cry
Neurology,throbbing weakness
Ophthalmology,eye discharge with associated sensitivity to light
